{
  "$schema": "http://json-schema.org/draft-07/schema#",
  "title": "service-profile",
  "type": "object",
  "x-required": ["source_urls", "captured_at", "icp", "voc", "positioning", "evidence"],
  "properties": {
    "source_urls": { "type": "array", "items": { "type": "string" } },
    "captured_at": { "type": "string", "description": "ISO-8601 timestamp" },
    "icp": {
      "type": "object",
      "x-required": ["segment", "pains", "goals"],
      "properties": {
        "segment": { "type": "string" },
        "pains": { "type": "array", "items": { "type": "string" } },
        "goals": { "type": "array", "items": { "type": "string" } }
      }
    },
    "voc": {
      "type": "array",
      "description": "voice-of-customer quotes mined from reviews/social",
      "items": {
        "type": "object",
        "x-required-item": ["quote", "source_url"],
        "properties": {
          "quote": { "type": "string" },
          "source_url": { "type": "string" },
          "sentiment": { "type": "string" }
        }
      }
    },
    "positioning": {
      "type": "object",
      "x-required": ["value_prop", "category"],
      "properties": {
        "value_prop": { "type": "string" },
        "category": { "type": "string" },
        "differentiators": { "type": "array", "items": { "type": "string" } }
      }
    },
    "evidence": {
      "type": "array",
      "description": "every claim ties to a source",
      "items": {
        "type": "object",
        "x-required-item": ["claim", "source_url"],
        "properties": {
          "claim": { "type": "string" },
          "source_url": { "type": "string" }
        }
      }
    }
  }
}
